{
  "id": "mac-36-q5",
  "description": "Same as mac-36 but the coder at Q5_K_M (~20 GB) for better tool-call formatting. Needs 36 GB.",
  "trigger": {
    "gpu": "apple",
    "unified_memory": true,
    "min_ram_gb": 32
  },
  "disk_gb": 25.13,
  "models": [
    {
      "role": "fast",
      "name": "Qwen3.5-4B",
      "repo": "unsloth/Qwen3.5-4B-GGUF",
      "include": [
        "*Q8_0*.gguf",
        "mmproj-F16.gguf"
      ],
      "license": "Apache-2.0",
      "tier": "main",
      "size_gb": 4.5
    },
    {
      "role": "code",
      "name": "Qwen3.8-27B",
      "repo": "unsloth/Qwen3.8-27B-GGUF",
      "include": [
        "*Q5_K_M*.gguf",
        "mmproj-F16.gguf"
      ],
      "license": "Apache-2.0",
      "tier": "main",
      "size_gb": 20
    },
    {
      "role": "embed",
      "name": "Qwen3-Embedding-0.6B",
      "repo": "Qwen/Qwen3-Embedding-0.6B-GGUF",
      "include": [
        "*Q8_0*.gguf"
      ],
      "license": "Apache-2.0",
      "tier": "main",
      "size_gb": 0.7
    },
    {
      "role": "stt",
      "name": "whisper-small",
      "repo": "ggerganov/whisper.cpp",
      "include": [
        "ggml-small-q5_1.bin"
      ],
      "license": "MIT",
      "tier": "main",
      "size_gb": 0.19,
      "optional": true
    },
    {
      "role": "tts",
      "name": "piper voices (en, de, sl)",
      "repo": "rhasspy/piper-voices",
      "include": [
        "en/en_US/lessac/medium/en_US-lessac-medium.onnx",
        "en/en_US/lessac/medium/en_US-lessac-medium.onnx.json",
        "de/de_DE/thorsten/medium/de_DE-thorsten-medium.onnx",
        "de/de_DE/thorsten/medium/de_DE-thorsten-medium.onnx.json",
        "sl/sl_SI/artur/medium/sl_SI-artur-medium.onnx",
        "sl/sl_SI/artur/medium/sl_SI-artur-medium.onnx.json"
      ],
      "license": "MIT",
      "tier": "main",
      "size_gb": 0.2,
      "optional": true
    }
  ]
}
