{
  "id": "cpu",
  "description": "16 GB RAM, no usable GPU. Good assistant, scripts and small edits. Multi-step agent work is slow.",
  "trigger": {
    "gpu": "none",
    "min_ram_gb": 16
  },
  "disk_gb": 12.5,
  "models": [
    {
      "role": "fast",
      "name": "Qwen3.5-4B (with vision)",
      "repo": "unsloth/Qwen3.5-4B-GGUF",
      "include": [
        "*Q4_K_M*.gguf",
        "mmproj-F16.gguf"
      ],
      "license": "Apache-2.0",
      "tier": "main",
      "size_gb": 3.3
    },
    {
      "role": "code",
      "name": "Qwen3.5-9B",
      "repo": "unsloth/Qwen3.5-9B-GGUF",
      "include": [
        "*Q4_K_M*.gguf"
      ],
      "license": "Apache-2.0",
      "tier": "main",
      "size_gb": 6
    },
    {
      "role": "embed",
      "name": "Qwen3-Embedding-0.6B",
      "repo": "Qwen/Qwen3-Embedding-0.6B-GGUF",
      "include": [
        "*Q8_0*.gguf"
      ],
      "license": "Apache-2.0",
      "tier": "main",
      "size_gb": 0.7
    },
    {
      "role": "stt",
      "name": "whisper-small",
      "repo": "ggerganov/whisper.cpp",
      "include": [
        "ggml-small-q5_1.bin"
      ],
      "license": "MIT",
      "tier": "main",
      "size_gb": 0.19,
      "optional": true
    },
    {
      "role": "tts",
      "name": "piper voices (en, de, sl)",
      "repo": "rhasspy/piper-voices",
      "include": [
        "en/en_US/lessac/medium/en_US-lessac-medium.onnx",
        "en/en_US/lessac/medium/en_US-lessac-medium.onnx.json",
        "de/de_DE/thorsten/medium/de_DE-thorsten-medium.onnx",
        "de/de_DE/thorsten/medium/de_DE-thorsten-medium.onnx.json",
        "sl/sl_SI/artur/medium/sl_SI-artur-medium.onnx",
        "sl/sl_SI/artur/medium/sl_SI-artur-medium.onnx.json"
      ],
      "license": "MIT",
      "tier": "main",
      "size_gb": 0.2,
      "optional": true
    },
    {
      "role": "rerank",
      "name": "bge-reranker-v2-m3",
      "repo": "gpustack/bge-reranker-v2-m3-GGUF",
      "include": [
        "*Q8_0*.gguf"
      ],
      "license": "MIT",
      "tier": "main",
      "size_gb": 0.6
    },
    {
      "role": "fim",
      "name": "Qwen2.5-Coder-1.5B",
      "repo": "Qwen/Qwen2.5-Coder-1.5B-GGUF",
      "include": [
        "*q4_k_m*.gguf"
      ],
      "license": "Apache-2.0",
      "tier": "main",
      "size_gb": 1.1
    }
  ]
}
