{
  "id": "tiny",
  "description": "Under 8 GB RAM, no GPU. Chat, summaries, ask about the screen, search over files. No agent.",
  "trigger": {
    "gpu": "none",
    "min_ram_gb": 4
  },
  "disk_gb": 3.83,
  "models": [
    {
      "role": "fast",
      "name": "Qwen3.5-2B (with vision)",
      "repo": "unsloth/Qwen3.5-2B-GGUF",
      "include": [
        "*Q4_K_M*.gguf",
        "mmproj-F16.gguf"
      ],
      "license": "Apache-2.0",
      "tier": "main",
      "size_gb": 2.0
    },
    {
      "role": "embed",
      "name": "Qwen3-Embedding-0.6B",
      "repo": "Qwen/Qwen3-Embedding-0.6B-GGUF",
      "include": [
        "*Q8_0*.gguf"
      ],
      "license": "Apache-2.0",
      "tier": "main",
      "size_gb": 0.7
    },
    {
      "role": "stt",
      "name": "whisper-base",
      "repo": "ggerganov/whisper.cpp",
      "include": [
        "ggml-base-q5_1.bin"
      ],
      "license": "MIT",
      "tier": "main",
      "size_gb": 0.06,
      "optional": true
    },
    {
      "role": "tts",
      "name": "piper voices (en, de, sl)",
      "repo": "rhasspy/piper-voices",
      "include": [
        "en/en_US/lessac/medium/en_US-lessac-medium.onnx",
        "en/en_US/lessac/medium/en_US-lessac-medium.onnx.json",
        "de/de_DE/thorsten/medium/de_DE-thorsten-medium.onnx",
        "de/de_DE/thorsten/medium/de_DE-thorsten-medium.onnx.json",
        "sl/sl_SI/artur/medium/sl_SI-artur-medium.onnx",
        "sl/sl_SI/artur/medium/sl_SI-artur-medium.onnx.json"
      ],
      "license": "MIT",
      "tier": "main",
      "size_gb": 0.2,
      "optional": true
    }
  ]
}
