{
  "id": "gpu-8",
  "description": "8 GB VRAM. Single-file coding, browsing help, screen questions. No reliable multi-file agent.",
  "trigger": {
    "gpu": "any",
    "min_vram_gb": 8
  },
  "disk_gb": 20,
  "models": [
    {
      "role": "fast",
      "name": "Qwen3.5-4B",
      "repo": "unsloth/Qwen3.5-4B-GGUF",
      "include": [
        "*Q4_K_M*.gguf",
        "mmproj-F16.gguf"
      ],
      "license": "Apache-2.0",
      "tier": "main",
      "size_gb": 2.6
    },
    {
      "role": "code",
      "name": "Qwen3.5-9B",
      "repo": "unsloth/Qwen3.5-9B-GGUF",
      "include": [
        "*Q4_K_M*.gguf",
        "mmproj-F16.gguf"
      ],
      "license": "Apache-2.0",
      "tier": "main",
      "size_gb": 6
    },
    {
      "role": "chat",
      "name": "gpt-oss-20b",
      "repo": "unsloth/gpt-oss-20b-GGUF",
      "include": [
        "*Q4_K_M*.gguf"
      ],
      "license": "Apache-2.0",
      "tier": "main",
      "size_gb": 11.6,
      "optional": true,
      "note": "MXFP4 native, needs CPU offload on 8 GB"
    },
    {
      "role": "embed",
      "name": "Qwen3-Embedding-0.6B",
      "repo": "Qwen/Qwen3-Embedding-0.6B-GGUF",
      "include": [
        "*Q8_0*.gguf"
      ],
      "license": "Apache-2.0",
      "tier": "main",
      "size_gb": 0.7
    },
    {
      "role": "stt",
      "name": "whisper-base",
      "repo": "ggerganov/whisper.cpp",
      "include": [
        "ggml-base-q5_1.bin"
      ],
      "license": "MIT",
      "tier": "main",
      "size_gb": 0.06,
      "optional": true
    },
    {
      "role": "tts",
      "name": "piper-en_US-lessac",
      "repo": "rhasspy/piper-voices",
      "include": [
        "en/en_US/lessac/medium/en_US-lessac-medium.onnx",
        "en/en_US/lessac/medium/en_US-lessac-medium.onnx.json"
      ],
      "license": "MIT",
      "tier": "main",
      "size_gb": 0.07,
      "optional": true
    }
  ]
}
