{
  "id": "gpu-48",
  "description": "48 GB+ VRAM or 128 GB unified. Closest to a cloud coding assistant locally.",
  "trigger": {
    "gpu": "any",
    "min_vram_gb": 48
  },
  "disk_gb": 130.13,
  "models": [
    {
      "role": "fast",
      "name": "Qwen3.5-4B",
      "repo": "unsloth/Qwen3.5-4B-GGUF",
      "include": [
        "*Q8_0*.gguf",
        "mmproj-F16.gguf"
      ],
      "license": "Apache-2.0",
      "tier": "main",
      "size_gb": 4.5
    },
    {
      "role": "code",
      "name": "Qwen3-Coder-Next 80B-A3B",
      "repo": "unsloth/Qwen3-Coder-Next-GGUF",
      "include": [
        "*Q4_K_M*.gguf"
      ],
      "license": "Apache-2.0",
      "tier": "main",
      "size_gb": 48.5
    },
    {
      "role": "chat",
      "name": "gpt-oss-120b",
      "repo": "unsloth/gpt-oss-120b-GGUF",
      "include": [
        "*Q4_K_M*.gguf"
      ],
      "license": "Apache-2.0",
      "tier": "main",
      "size_gb": 63,
      "optional": true,
      "note": "needs 64 GB+; skipped on 48 GB cards"
    },
    {
      "role": "vision",
      "name": "Qwen3.8-27B",
      "repo": "unsloth/Qwen3.8-27B-GGUF",
      "include": [
        "*Q5_K_M*.gguf",
        "mmproj-F16.gguf"
      ],
      "license": "Apache-2.0",
      "tier": "main",
      "size_gb": 20
    },
    {
      "role": "embed",
      "name": "Qwen3-Embedding-0.6B",
      "repo": "Qwen/Qwen3-Embedding-0.6B-GGUF",
      "include": [
        "*Q8_0*.gguf"
      ],
      "license": "Apache-2.0",
      "tier": "main",
      "size_gb": 0.7
    },
    {
      "role": "stt",
      "name": "whisper-small",
      "repo": "ggerganov/whisper.cpp",
      "include": [
        "ggml-small-q5_1.bin"
      ],
      "license": "MIT",
      "tier": "main",
      "size_gb": 0.19,
      "optional": true
    },
    {
      "role": "tts",
      "name": "piper voices (en, de, sl)",
      "repo": "rhasspy/piper-voices",
      "include": [
        "en/en_US/lessac/medium/en_US-lessac-medium.onnx",
        "en/en_US/lessac/medium/en_US-lessac-medium.onnx.json",
        "de/de_DE/thorsten/medium/de_DE-thorsten-medium.onnx",
        "de/de_DE/thorsten/medium/de_DE-thorsten-medium.onnx.json",
        "sl/sl_SI/artur/medium/sl_SI-artur-medium.onnx",
        "sl/sl_SI/artur/medium/sl_SI-artur-medium.onnx.json"
      ],
      "license": "MIT",
      "tier": "main",
      "size_gb": 0.2,
      "optional": true
    }
  ]
}
