{
  "id": "gpu-24",
  "description": "Target tier: 24 GB VRAM (RTX 3090/4090/5090) or 64 GB unified. Reliable multi-file agentic coding.",
  "trigger": {
    "gpu": "any",
    "min_vram_gb": 24
  },
  "disk_gb": 50.13,
  "models": [
    {
      "role": "fast",
      "name": "Qwen3.5-4B",
      "repo": "unsloth/Qwen3.5-4B-GGUF",
      "include": [
        "*Q8_0*.gguf",
        "mmproj-F16.gguf"
      ],
      "license": "Apache-2.0",
      "tier": "main",
      "size_gb": 4.5
    },
    {
      "role": "code",
      "name": "Qwen3.8-27B",
      "repo": "unsloth/Qwen3.8-27B-GGUF",
      "include": [
        "*Q5_K_M*.gguf",
        "mmproj-F16.gguf"
      ],
      "license": "Apache-2.0",
      "tier": "main",
      "size_gb": 20
    },
    {
      "role": "chat",
      "name": "Qwen3.6-35B-A3B",
      "repo": "unsloth/Qwen3.6-35B-A3B-GGUF",
      "include": [
        "*Q4_K_M*.gguf"
      ],
      "license": "Apache-2.0",
      "tier": "main",
      "size_gb": 22
    },
    {
      "role": "embed",
      "name": "Qwen3-Embedding-0.6B",
      "repo": "Qwen/Qwen3-Embedding-0.6B-GGUF",
      "include": [
        "*Q8_0*.gguf"
      ],
      "license": "Apache-2.0",
      "tier": "main",
      "size_gb": 0.7
    },
    {
      "role": "rerank",
      "name": "bge-reranker-v2-m3",
      "repo": "gpustack/bge-reranker-v2-m3-GGUF",
      "include": [
        "*Q8_0*.gguf"
      ],
      "license": "MIT",
      "tier": "main",
      "size_gb": 0.6
    },
    {
      "role": "fim",
      "name": "Qwen2.5-Coder-1.5B",
      "repo": "Qwen/Qwen2.5-Coder-1.5B-Instruct-GGUF",
      "include": [
        "*q8_0*.gguf"
      ],
      "license": "Apache-2.0",
      "tier": "main",
      "size_gb": 1.7
    },
    {
      "role": "stt",
      "name": "whisper-small",
      "repo": "ggerganov/whisper.cpp",
      "include": [
        "ggml-small-q5_1.bin"
      ],
      "license": "MIT",
      "tier": "main",
      "size_gb": 0.19,
      "optional": true
    },
    {
      "role": "tts",
      "name": "piper voices (en, de, sl)",
      "repo": "rhasspy/piper-voices",
      "include": [
        "en/en_US/lessac/medium/en_US-lessac-medium.onnx",
        "en/en_US/lessac/medium/en_US-lessac-medium.onnx.json",
        "de/de_DE/thorsten/medium/de_DE-thorsten-medium.onnx",
        "de/de_DE/thorsten/medium/de_DE-thorsten-medium.onnx.json",
        "sl/sl_SI/artur/medium/sl_SI-artur-medium.onnx",
        "sl/sl_SI/artur/medium/sl_SI-artur-medium.onnx.json"
      ],
      "license": "MIT",
      "tier": "main",
      "size_gb": 0.2,
      "optional": true
    }
  ]
}
